{
  "schema_version": "stage-timing/1.0",
  "trace_id": "ts07-chrome-fallback-retest-20260804",
  "slice_id": "TS-07",
  "clock": "monotonic",
  "trace_started_at": "2026-08-04T08:57:57.289Z",
  "milestones": [
    {
      "name": "timeline.audit_started",
      "offset_ms": 0,
      "latency_scope": "diagnostic"
    },
    {
      "name": "timeline.audit_completed",
      "offset_ms": 76864.0,
      "latency_scope": "diagnostic"
    }
  ],
  "spans": [
    {
      "span_id": "timeline.audit",
      "parent_span_id": null,
      "stage": "timeline.audit",
      "started_offset_ms": 0,
      "ended_offset_ms": 76864.0,
      "duration_ms": 76864.0,
      "latency_scope": "system_work",
      "outcome": "success",
      "retry_index": 0,
      "cache_status": "not_applicable",
      "provider": "local_google_chrome",
      "model": null,
      "input_units": 5,
      "output_units": 5,
      "cost_amount": 0,
      "cost_currency": "CNY",
      "error_code": null
    }
  ]
}
